00:00|двенадцать часов ночи|В двенадцать часов ночи еще танцевали. Элен, не имевшая достойного кавалера, сама предложила мазурку Борису.|Война и мир. Том 3|Лев Николаевич Толстой|sfw
00:00|полночь|Была лунная зимняя полночь, мы ночевали на хуторе в Тамбовской губернии, по пути в Петербург с юга, и спали в детской, единственной теплой комнате во всем доме.|Новый год|Иван Бунин|sfw
00:00|полночь|-- Как долго ждать! Уже и полночь прошла.|Мудрые девы|Фёдор Сологуб|sfw
00:00|полночь|Страшное время -- полночь в дебрях леса.|Трущёбные люди|Владимир Гиляровский|sfw
00:00|полночь|Несравненно ужаснее и отвратительнее полночь в трущобах большого города, в трущобах блестящей, многолюдной столицы. И чем богаче, обширнее столица тем ужаснее трущобы...|Трущёбные люди|Владимир Гиляровский|sfw
00:00|полночь|В полночь они заботятся о будущей ночи, в полночь они устраивают свои ужасные оргии и топят в них воспоминания о своей -- прежней, лучшей жизни.|Трущёбные люди|Владимир Гиляровский|sfw
00:00|полночь|В полночь он услышал голос помощника, звавший его на палубу. Ещё через несколько минут боцман услышал голос капитана, звавший его на палубу.|Самсон Назорей|Владимир Жаботинский|sfw
00:00|полночь|Пропивая как-то в "Бедных людях" мелкий гонорар, он подслушал разговор двух известных телешоуменов - дело было за полночь, и они продолжали начатую в другом месте пьянку.|Generation "П"|Виктор Пелевин|sfw
00:00|первый час ночи|Шел первый час ночи. Дождь лился по крыше ровный и цельный, точно вся ядовитая, бесформенная и сплошная скука, которая гнездилась на земле, собралась и впиталась в его капли.|Бабаев|Сергей Николаевич Сергеев-Ценский|sfw
00:00|часы бьют двенадцать|Внезапно ему пришло в голову, что он занят всегда лишь тем, что переставляет вещи с одного места на другое или указывает другим, как это делать. И он подумал: "А что будет, если я перестану этим заниматься?" "Ничего не будет, найдутся желающие на мое место", -- ответил он сам себе и поставил зубную щетку в стакан. Эти слова удивили и даже немного испугали его, и по спине у него поползли мурашки, точь-в-точь как в новогоднюю полночь, когда часы бьют двенадцать.|В конце ноября|Туве Янссон|sfw
00:43|сорок три минуты первого|Я взглянул на щиток, часы показывали сорок три минуты первого. "Волга" фыркнула на повороте и въехала в Рабочую улицу. Проезжую часть загораживал строительный тамбур.|Двое среди людей|Вайнер Аркадий Александрович, Вайнер Георгий Александрович|sfw
00:53|0 часов 53 минуты|Баг тем временем уже прошёлся пальцами по клавиатуре "Керулена". Действительно, отметка о том, что цзюйжэнь Берзин Ландсбергис покинул территорию ризницы в 0 часов 53 минуты имела место в охранной системе Патриархии.|Дело жадного варвара|Хольм ван Зайчик|sfw
01:00|час ночи|В час ночи два чемодана были затянуты ремнями. Но выйти из дома нельзя. - Люба, - проговорил Азеф, - потуши везде свет, пусть думают, что лег спать...|Азеф|Роман Гуль|sfw
01:05|пять минут второго|Он пошел, притащил огромную лестницу, подождал минут пять - может быть, она еще одумается? - и ровно в пять минут второго приставил лестницу к окну Матильды. Он поднялся тихонько, держа пистолет в руке, удивляясь про себя, что его до сих пор не схватили. Когда он поравнялся с окном, оно бесшумно раскрылось.|Красное и черное|Стендаль|sfw
01:15|Пятнадцать минут второго.|Час ночи. В голову лезла всякая дрянь. Нужно чем-нибудь заняться. Попил чай. Пятнадцать минут второго. Выпил кофе. Двадцать пять минут второго. Достал открытки с Тулуз Лотреком. Тридцать семь минут второго. Шаги на лестнице. Это она! Она повернула ключ и вошла. Я бросился встречать ее.|Мария|Иннокентий Сергеев|sfw
01:16|01:16|01:16: Мы ждали за одним из немногочисленных столиков узкого бара в начале улицы Виньон. Карпантьери выбрал место поближе к окну. Он подстерегал кого-то на улице. - Это всегда бывает между четвертью и половиной второго ночи, - сказал он. Стенные часы в глубине зала показывали двадцать три минуты второго.|Утраченный мир|Патрик Модиано|sfw
01:17|01:17|01:17: Мы ждали за одним из немногочисленных столиков узкого бара в начале улицы Виньон. Карпантьери выбрал место поближе к окну. Он подстерегал кого-то на улице. - Это всегда бывает между четвертью и половиной второго ночи, - сказал он. Стенные часы в глубине зала показывали двадцать три минуты второго.|Утраченный мир|Патрик Модиано|sfw
01:18|01:18|01:18: Мы ждали за одним из немногочисленных столиков узкого бара в начале улицы Виньон. Карпантьери выбрал место поближе к окну. Он подстерегал кого-то на улице. - Это всегда бывает между четвертью и половиной второго ночи, - сказал он. Стенные часы в глубине зала показывали двадцать три минуты второго.|Утраченный мир|Патрик Модиано|sfw
01:19|01:19|01:19: Мы ждали за одним из немногочисленных столиков узкого бара в начале улицы Виньон. Карпантьери выбрал место поближе к окну. Он подстерегал кого-то на улице. - Это всегда бывает между четвертью и половиной второго ночи, - сказал он. Стенные часы в глубине зала показывали двадцать три минуты второго.|Утраченный мир|Патрик Модиано|sfw
01:20|01:20|01:20: Мы ждали за одним из немногочисленных столиков узкого бара в начале улицы Виньон. Карпантьери выбрал место поближе к окну. Он подстерегал кого-то на улице. - Это всегда бывает между четвертью и половиной второго ночи, - сказал он. Стенные часы в глубине зала показывали двадцать три минуты второго.|Утраченный мир|Патрик Модиано|sfw
01:21|01:21|01:21: Мы ждали за одним из немногочисленных столиков узкого бара в начале улицы Виньон. Карпантьери выбрал место поближе к окну. Он подстерегал кого-то на улице. - Это всегда бывает между четвертью и половиной второго ночи, - сказал он. Стенные часы в глубине зала показывали двадцать три минуты второго.|Утраченный мир|Патрик Модиано|sfw
01:22|01:22|01:22: Мы ждали за одним из немногочисленных столиков узкого бара в начале улицы Виньон. Карпантьери выбрал место поближе к окну. Он подстерегал кого-то на улице. - Это всегда бывает между четвертью и половиной второго ночи, - сказал он. Стенные часы в глубине зала показывали двадцать три минуты второго.|Утраченный мир|Патрик Модиано|sfw
01:23|двадцать три минуты второго|Стенные часы в глубине зала показывали двадцать три минуты второго.|Утраченный мир|Патрик Модиано|sfw
01:24|01:24|01:24: Мы ждали за одним из немногочисленных столиков узкого бара в начале улицы Виньон. Карпантьери выбрал место поближе к окну. Он подстерегал кого-то на улице. - Это всегда бывает между четвертью и половиной второго ночи, - сказал он. Стенные часы в глубине зала показывали двадцать три минуты второго.|Утраченный мир|Патрик Модиано|sfw
01:25|Двадцать пять минут второго.|Час ночи. В голову лезла всякая дрянь. Нужно чем-нибудь заняться. Попил чай. Пятнадцать минут второго. Выпил кофе. Двадцать пять минут второго. Достал открытки с Тулуз Лотреком. Тридцать семь минут второго. Шаги на лестнице. Это она! Она повернула ключ и вошла. Я бросился встречать ее.|Мария|Иннокентий Сергеев|sfw
01:26|01:26|01:26: Мы ждали за одним из немногочисленных столиков узкого бара в начале улицы Виньон. Карпантьери выбрал место поближе к окну. Он подстерегал кого-то на улице. - Это всегда бывает между четвертью и половиной второго ночи, - сказал он. Стенные часы в глубине зала показывали двадцать три минуты второго.|Утраченный мир|Патрик Модиано|sfw
01:27|01:27|01:27: Мы ждали за одним из немногочисленных столиков узкого бара в начале улицы Виньон. Карпантьери выбрал место поближе к окну. Он подстерегал кого-то на улице. - Это всегда бывает между четвертью и половиной второго ночи, - сказал он. Стенные часы в глубине зала показывали двадцать три минуты второго.|Утраченный мир|Патрик Модиано|sfw
01:28|01:28|01:28: Мы ждали за одним из немногочисленных столиков узкого бара в начале улицы Виньон. Карпантьери выбрал место поближе к окну. Он подстерегал кого-то на улице. - Это всегда бывает между четвертью и половиной второго ночи, - сказал он. Стенные часы в глубине зала показывали двадцать три минуты второго.|Утраченный мир|Патрик Модиано|sfw
01:29|01:29|01:29: Мы ждали за одним из немногочисленных столиков узкого бара в начале улицы Виньон. Карпантьери выбрал место поближе к окну. Он подстерегал кого-то на улице. - Это всегда бывает между четвертью и половиной второго ночи, - сказал он. Стенные часы в глубине зала показывали двадцать три минуты второго.|Утраченный мир|Патрик Модиано|sfw
01:30|Половина второго ночи|Только что ушли последние гости. В гостиной повсюду стояли пустые стаканы. Пенелопа на кухне вытряхивала пепельницы. Он посмотрел на часы. Половина второго ночи. Засиделись гости. Он опустился в кресло и скинул ботинки. Ужинало четырнадцать человек. Стол был отличный. Компания скучная. Он выпил слишком много вина.|Вечер в Византии|Ирвин Шоу|sfw
01:35|тридцать пять минут второго|Зазвонил телефон. Он ошалело тряхнул головой, точно его вдруг пробудили от тяжелого сна. Опять ему пришлось вспоминать, где он находится и где стоит телефон. "Я в своем номере в отеле "Карлтон", а телефон на столике, по ту сторону кресла". Телефон опять зазвонил. Он взглянул на часы: тридцать пять минут второго. Он помедлил, думая, надо ли брать трубку. Ему не хотелось больше слушать бессвязное бормотание из Америки. Но он все же решил взять.|Вечер в Византии|Ирвин Шоу|sfw
01:37|Тридцать семь минут второго.|Час ночи. В голову лезла всякая дрянь. Нужно чем-нибудь заняться. Попил чай. Пятнадцать минут второго. Выпил кофе. Двадцать пять минут второго. Достал открытки с Тулуз Лотреком. Тридцать семь минут второго. Шаги на лестнице. Это она! Она повернула ключ и вошла. Я бросился встречать ее.|Мария|Иннокентий Сергеев|sfw
02:00|с двух часов ночи|Русские войска проходили через Москву с двух часов ночи и до двух часов дня и увлекали за собой последних уезжавших жителей и раненых.|Война и мир. Том 3|Лев Николаевич Толстой|sfw
02:00|два часа ночи|Было два часа ночи. Мале подошел к дверям кордегардии Десятой когорты Национальной гвардии Парижа. -- Кто идет? -- окликнул часовой. -- "Конспирация"... -- .."Кампания"! -- ответил Мале, и перед ним широко распахнулись ворота столичной казармы.|Исторические миниатюры|Валентин Пикуль|sfw
02:00|два часа ночи|Я взглянул на часы. Было два часа ночи, я не слишком твердо держался на ногах, да и в голове изрядно шумело.|Земля обетованная|Эрих Мария Ремарк|sfw
02:25|2:25|Телефон зазвонил среди ночи. Он открыл глаза - на часах 2:25. Спросонья он долго не мог сообразить, какого дьявола в таком месте вообще звонит телефон.|Рвота|Харуки Мураками|sfw
02:30|половина третьего|А вы говорите, чудес на свете не бывает. Уже на платформе Семен обнаружил, что в Москве время движется не так, как всюду. Иначе никак невозможно было объяснить того обстоятельства, что стрелки на башне Казанского вокзала показывали пятнадцать минут девятого, в то время как на циферблате навороченных "командирских" часов Семена была половина третьего нового дня.|Книга счастья. Новый русский водевиль|Игорь Плотник|sfw
02:30|2 часа 30 минут|Но членских взносов оказалось мало. Пришлось организовать карточную игру с запрещенной "железкой". Члены Охотничьего клуба, избранные и сюда, сумели организовать крупную игру, и штрафы с засидевшихся за "железкой" игроков пополняли кассу. Штрафы были такие: в 2 часа ночи -- 30 копеек, в 2 часа 30 минут -- 90 копеек, то есть удвоенная сумма плюс основная, в 3 часа -- 2 рубля 10 копеек, в 3 часа 30 минут -- 4 рубля 50 копеек, в 4 часа -- 9 рублей 30 копеек, в 5 часов -- 18 рублей 60 копеек, а затем Кружок в 6 часов утра закрывался, и игроки должны были оставлять помещение, но нередко игра продолжалась и днем, и снова до вечера...|Москва и москвичи|Владимир Гиляровский|sfw
02:30|в половине третьего ночи|...Он приехал в половине третьего ночи, но ещё и в десять минут четвёртого с большим чистым блокнотом в руках ходил по приёмной и томился, ощущая внутреннюю слабость от боязни, а уши его между тем предательски разгорались. Больше всего он был бы сейчас рад, если б Сталин заработался и вообще не принял его сегодня: Абакумов опасался расправы за секретную телефонию. Он не знал, что теперь врать.|В круге первом (т.1)|Александр Солженицын|sfw
02:34|тридцать четыре минуты третьего|Увидел лишь темноту и подумал: "Я еще плохо знаю комнату и не могу ориентироваться". И все же с первого раза нащупал выключатель и не успел зажечь свет, как сразу нашел окно там, где искал его раньше. Посмотрел на часы. Было тридцать четыре минуты третьего.|Рассказы|Адольфо Бьой Касарес|sfw
02:34|тридцать четыре минуты третьего|Когда ему удалось доползти до кровати и зажечь свет, он увидел словно во сне, что стрелки часов показывают тридцать четыре минуты третьего. Подумал, что часы могли в какой-то момент остановиться. На самом деле он был уверен, что секундная стрелка не унималась в течение всей ночи.|Рассказы|Адольфо Бьой Касарес|sfw
02:37|тридцать семь минут третьего|Чтобы окончательно проснуться и избежать новых ошибок, пошел в уборную. Вернулся в кровать в тридцать семь минут третьего.|Рассказы|Адольфо Бьой Касарес|sfw
02:47|2:47|Я увидел ее в 2:47. Столько было на часах, когда я на них посмотрел. На этот раз девушка появилась чуть раньше, чем прошлой ночью. Я не спал -- ждал, когда она материализуется. Глаз не сомкнул, что моргал -- не считается. Но все равно момента, когда она возникла, не уловил. Как то проскользнула через слепую зону в моем сознании.|Кафка на пляже|Харуки Мураками|sfw
03:00|3 часа|Но членских взносов оказалось мало. Пришлось организовать карточную игру с запрещенной "железкой". Члены Охотничьего клуба, избранные и сюда, сумели организовать крупную игру, и штрафы с засидевшихся за "железкой" игроков пополняли кассу. Штрафы были такие: в 2 часа ночи -- 30 копеек, в 2 часа 30 минут -- 90 копеек, то есть удвоенная сумма плюс основная, в 3 часа -- 2 рубля 10 копеек, в 3 часа 30 минут -- 4 рубля 50 копеек, в 4 часа -- 9 рублей 30 копеек, в 5 часов -- 18 рублей 60 копеек, а затем Кружок в 6 часов утра закрывался, и игроки должны были оставлять помещение, но нередко игра продолжалась и днем, и снова до вечера...|Москва и москвичи|Владимир Гиляровский|sfw
03:03|три минуты четвертого|Над головой у меня висели часы. Было три минуты четвертого. В половине шестого я должен был явиться на допрос к Робертсу. Я встал, осторожно отделившись от нее, чтобы не потревожить ее сон, и оделся. В комнате было тепло и сухо.|Американская мечта|Норман Мейлер|sfw
