11:10|Десять минут двенадцатого|- Почему вы его убили? - крикнул старик. - Из осторожности, - отвечал равнодушно врач. - Десять минут двенадцатого, Время спешит, господин комиссар, время спешит. Осторожность никогда не мешает, Хунгертобеля я тоже убью.|Подозрение|Ф.Дюрренматт|nsfw
11:10|десять минут двенадцатого|Мистер Магнус вздрогнул, несколько мгновений молча смотрел на одухотворенное лицо мистера Пиквика, а затем (часы показывали десять минут двенадцатого) горячо пожал ему руку и бросился с решимостью отчаяния вон из комнаты.|Посмертные записки Пиквикского Клуба|Чарльз Диккенс|sfw
11:14|четырнадцать минут двенадцатого|Часы показывали четырнадцать минут двенадцатого. Комиссар очень устал и время от времени закрывал глаза; каждый раз, когда он их открывал, видел часы, каждый раз большие, круглые, плывущие в пространстве часы. Берлах понял, что спасенья нет. Он погиб. Хунгертобель тоже. Эменбергер разгадал замыслы комиссара.|Подозрение|Ф.Дюрренматт|sfw
11:15|пятнадцать минут двенадцатого|Часы показывали уже пятнадцать минут двенадцатого. Все были в сборе, кроме Артиста. Горобец нервно барабанил пальцами по столу. Мои парни были несколько напряжены. Они не привыкли к тому, что каждый их шаг контролируется сверху. Наше спецподразделение обычно действовало самостоятельно. Впрочем, сейчас я прекрасно понимал волнение Горобца. В том случае, если Хусаинова убьют, у подполковника будут крупные неприятности и работу он свою наверняка потеряет.|Пятеро против всех|Андрей Таманцев|nsfw
11:16|шестнадцать минут двенадцатого|Он посмотрел на часы. Ему казалось, что уже двадцать минут двенадцатого, а было только шестнадцать минут двенадцатого. У него были красивые, тяжелые, золотые часы; он получил их от деда Эммануила в день своего тринадцатилетия, когда его впервые вызвали к торе.|Семья Опперман|Лион Фейхтвангер|sfw
11:20|двадцать минут двенадцатого|Он посмотрел на часы. Ему казалось, что уже двадцать минут двенадцатого, а было только шестнадцать минут двенадцатого. У него были красивые, тяжелые, золотые часы; он получил их от деда Эммануила в день своего тринадцатилетия, когда его впервые вызвали к торе.|Семья Опперман|Лион Фейхтвангер|sfw
11:25|двадцать пять минут двенадцатого|Теперь, должно быть, уже двадцать пять минут двенадцатого. Нет, двадцать одна. Только бы сидеть прямо, не опускать головы. Бертольду придется тяжелей. Ему, Мартину, приходится только сидеть. А мальчик его должен стать перед товарищами и сказать: "То, что я выдавал за правду, - ложь. Я лгал". Одиннадцать часов тридцать минут. Мартин подзывает ближайшего служащего и просит напомнить господину Вельсу, что он его ждет.|Семья Опперман|Лион Фейхтвангер|sfw
11:25|двадцать пять минут двенадцатого|- Сейчас двадцать пять минут двенадцатого, - возразил Эменбергер. - Вы очень любезны, напоминая мне о времени, - простонал старик, дрожа от гнева и бессилия.|Подозрение|Ф.Дюрренматт|sfw
11:28|двадцать восемь минут двенадцатого|И он сжимал в потном кулаке скомканную записку, сидя у окошка готового к отправлению вагона, отсчитывая время до отхода, которое теперь пошло скачками, очень быстро. Кругом все спрашивали и повторяли: сорок минут осталось... Сейчас точно двадцать восемь минут двенадцатого... Семнадцать минут до отхода!..|Одна жизнь|Федор Федорович Кнорре|sfw
11:30|Одиннадцать часов тридцать минут|Теперь, должно быть, уже двадцать пять минут двенадцатого. Нет, двадцать одна. Только бы сидеть прямо, не опускать головы. Бертольду придется тяжелей. Ему, Мартину, приходится только сидеть. А мальчик его должен стать перед товарищами и сказать: "То, что я выдавал за правду, - ложь. Я лгал". Одиннадцать часов тридцать минут. Мартин подзывает ближайшего служащего и просит напомнить господину Вельсу, что он его ждет.|Семья Опперман|Лион Фейхтвангер|sfw
11:30|ровно в половине двенадцатого|- Так вот, сэр, я и подумал, что, если вы подождете один в саду и я вас впущу ровно в половине двенадцатого через дверь в конце коридора, выходящую в сад, вы поспеете как раз вовремя и поможете мне разрушить замыслы этого дурного человека, к которому я, по несчастью, попал в лапы.|Посмертные записки Пиквикского Клуба|Чарльз Диккенс|sfw
11:30|половины двенадцатого|- Ах, вот оно что. Ты просто голодна, Делла. Давай разбираться с письмами. Забудем об Эдварде Картере Джилмане до половины двенадцатого.|Двойник дочери|Эрл Стенли Гарднер|sfw
11:32|тридцать две минуты двенадцатого|Он покосился на телефонный аппарат. Молчит... Совещание "наверху" еще не кончилось, Было тридцать две минуты двенадцатого.|Дом скитальцев|Александр Мирер|sfw
11:33|тридцать три минуты двенадцатого|Было тридцать три минуты двенадцатого, когда в глубине холла послышался какой-то шум. Этот шум исходил из катафалка, с которого погребальный покров соскользнул на пол, точно сдернутый чьей-то невидимой рукой. И тогда - о, чудо! - в то время как Лисси Вэг прижималась к плечу Макса Реаля, крышка гроба медленно приподнялась и лежавшее в нем тело привстало... А в следующую минуту все присутствующие увидели перед собой не мертвеца - нет, но человека живого, вполне живого, и человек этот был не кто иной, как покойный Уильям Гиппербон!|Завещание чудака|Жюль Верн|sfw
11:35|тридцать пять минут двенадцатого|Сражение началось поздно. Наполеон, как мы уже говорили, имел обыкновение сосредоточивать в своих руках всю артиллерию, целясь, словно из пистолета, то в одно, то в другое место поля битвы; и теперь он поджидал, когда батареи, поставленные на колеса, смогут быстро и свободно передвигаться; для этого необходимо было выглянуть солнцу и обсушить землю. Но солнце не выглянуло. Под Аустерлицем оно встретило его по-другому! Когда раздался первый пушечный залп, английский генерал Кольвиль, взглянув на часы, отметил, что было тридцать пять минут двенадцатого.|Отверженные (Часть 1,2)|Виктор Мари Гюго|sfw
11:40|без двадцати минут двенадцать|Хотя часы служили ему давно, но он и теперь, как всегда при людях, с удовольствием глянул на их большие золотые крышки. Было без двадцати минут двенадцать.|Мелкий бес|Федор Кузьмич Сологуб|sfw
11:40|без двадцати двенадцать|Схватил шапку и бежать. И пирога не доел. Что делать! Хотел за ним, совета попросить, смотрю -- а уж без двадцати двенадцать: в ресторан надо. А день праздничный, бойкий, и надо начеку быть.|Человек из ресторана|Иван Шмелев|sfw
11:45|сорок пять минут двенадцатого|Было сорок пять минут двенадцатого, и ничего другого не оставалось, как ожидать телеграммы, которая, несомненно, была послана из Чикаго. Ждать ее пришлось недолго. В одиннадцать часов пятьдесят три минуты затрещал телеграфный аппарат, его механизм пришел в действие, и узкая полоска бумажной ленты начала разматываться.|Завещание чудака|Жюль Верн|sfw
11:52|без восьми минут двенадцать|- И слушать ничего не буду. Извольте быстро одеться. Я жду вас тут, в коридоре. Прошу иметь в виду, что сейчас - без восьми минут двенадцать.|Гостиница "Лондонская"|Алексей Иванович Пантелеев|sfw
11:53|одиннадцать часов пятьдесят три минуты|Ждать ее пришлось недолго. В одиннадцать часов пятьдесят три минуты затрещал телеграфный аппарат, его механизм пришел в действие, и узкая полоска бумажной ленты начала разматываться.|Завещание чудака|Жюль Верн|sfw
11:57|без трёх минут двенадцать|Вниз сошел помощник капитана. Отдал честь: -- Мадам Ламоль, без трёх минут двенадцать, сейчас будут вызывать по радио...|Гиперболоид инженера Гарина|Алексей Толстой|sfw
11:57|без трех минут двенадцать|Врач замолчал. Он медленно поднялся и сел на операционный стол. Часы над ним показывали без трех минут двенадцать, без двух, без одной...|Подозрение|Ф.Дюрренматт|sfw
12:00|полдень|Был жаркий полдень, листок не шевелился, ветер подувал то с той, то с другой стороны.|Облако|Константин Аксаков|sfw
12:00|12|Княжна взглянула на часы и, заметив, что она уже пять минут пропустила то время, которое должна была употреблять для игры на клавикордах, с испуганным видом пошла в диванную. Между 12 и 2 часами, сообразно с заведенным порядком дня, князь отдыхал, а княжна играла на клавикордах.|Война и мир. Том 1|Лев Николаевич Толстой|sfw
12:00|12 часов|Молодой император не мог воздержаться от желания присутствовать при сражении и, несмотря на все представления придворных, в 12 часов, отделившись от 3-й колонны, при которой он следовал, поскакал к авангарду. Еще не доезжая до гусар, несколько адъютантов встретили его с известием о счастливом исходе дела.|Война и мир. Том 1|Лев Николаевич Толстой|sfw
12:00|В двенадцать часов|В двенадцать часов прозвенел звонок на обед. Обедали торопливо, без бузы и обычных скандалов. Когда кончили обед, в столовую вошел Викниксор и скомандовал: "Встать!" Ребята поднялись. В столовую торопливыми шагами вошла пожилая невысокая женщина, закутанная в серую пуховую шаль.|Республика ШКИД|Григорий Белых, Алексей Пантелеев.|sfw
12:00|двенадцать|Время шло; на часах соседнего монастыря пробило двенадцать. Дюруа вышел в другую комнату перекусить. Вернулся он через час. Г-жа Форестье отказалась от еды. Больной не шевелился. Только его костлявые пальцы попрежнему находились в движении и точно пытались натянуть одеяло на лицо.|Милый друг|Ги де Мопассан|sfw
12:00|на часах пробило двенадцать|Все встрепенулись, когда на часах пробило двенадцать, - время завтрака. Нана немедленно бросилась к окну и крикнула, что она пойдет за покупками; кто хочет, может поручить ей купить, что надо. Леони заказала креветок на два су, Огюстина - тюрик жареной картошки, Лиза - пучок редиски, Софи - сосиски.|Западня|Эмиль Золя|sfw
12:00|Часы пробили двенадцать|Часы пробили двенадцать. Потом час. В самом начале третьего Ондатру пришла нужда прогуляться на двор. Он сонно прошлепал на веранду и в величайшем изумлении остановился перед диваном, преградившим ему путь. "Это еще что за выдумки!" -- пробормотал Ондатр и решительно приступил к дивану. И, разумеется, тут сработал звонок тревожной сигнализации, который установил Муми-папа.|Шляпа волшебника|Туве Янссон|sfw
12:00|часы пробили двенадцать|Юксаре перестал есть и уставился на меня с удивлением, я бы даже сказал, с восхищением! Я достиг цели: спас свою репутацию и свой авторитет! Но, дорогие читатели, вы можете представить себе волнение, охватившее меня перед тем, как часы пробили двенадцать? Вернется ли привидение? Будет ли оно достаточно устрашающим? А вдруг начнет чихать, болтать всякую чепуху и испортит всю затею?|Мемуары папы Муми-тролля|Туве Янссон|sfw
12:00|Двенадцать часов дня|Старый сад при доме Прозоровых. Длинная еловая аллея, в конце которой видна река. На той стороне реки - лес. Направо терраса дома; здсеь на столе бутылки и стаканы; видно, что только что пили шампанское. Двенадцать часов дня. С улицы к реке через сад ходят изредка прохожие; быстро проходят человек пять солдат.|Три сестры|Антон Павлович Чехов|sfw
12:01|12:01|12:01: Между 12 и 2 часами, сообразно с заведенным порядком дня, князь отдыхал, а княжна играла на клавикордах.|Война и мир. Том 1|Лев Николаевич Толстой|sfw
12:02|12:02|12:02: Между 12 и 2 часами, сообразно с заведенным порядком дня, князь отдыхал, а княжна играла на клавикордах.|Война и мир. Том 1|Лев Николаевич Толстой|sfw
12:03|12:03|12:03: Между 12 и 2 часами, сообразно с заведенным порядком дня, князь отдыхал, а княжна играла на клавикордах.|Война и мир. Том 1|Лев Николаевич Толстой|sfw
12:04|12:04|12:04: Между 12 и 2 часами, сообразно с заведенным порядком дня, князь отдыхал, а княжна играла на клавикордах.|Война и мир. Том 1|Лев Николаевич Толстой|sfw
12:05|12:05|12:05: Между 12 и 2 часами, сообразно с заведенным порядком дня, князь отдыхал, а княжна играла на клавикордах.|Война и мир. Том 1|Лев Николаевич Толстой|sfw
12:05|пять минут первого|На часах -- пять минут первого. Гретхен аккуратно сложила напечатанные листочки в ящик стола. Все служащие уже ушли. Закрыв чехлом пишущую машинку, она пошла в туалет. Долго разглядывала себя в зеркало. Лицо горело, словно у нее температура. Она плеснула холодную воду на лоб, потом вытащила из сумочки флакончик с духами и пальчиком мазнула ароматной жидкостью за ушами.|Богач, бедняк (ч.1, 2)|Ирвин Шоу|sfw
12:06|12:06|12:06: Между 12 и 2 часами, сообразно с заведенным порядком дня, князь отдыхал, а княжна играла на клавикордах.|Война и мир. Том 1|Лев Николаевич Толстой|sfw
12:07|12:07|12:07: Между 12 и 2 часами, сообразно с заведенным порядком дня, князь отдыхал, а княжна играла на клавикордах.|Война и мир. Том 1|Лев Николаевич Толстой|sfw
12:08|12:08|12:08: Между 12 и 2 часами, сообразно с заведенным порядком дня, князь отдыхал, а княжна играла на клавикордах.|Война и мир. Том 1|Лев Николаевич Толстой|sfw
12:09|12:09|12:09: Между 12 и 2 часами, сообразно с заведенным порядком дня, князь отдыхал, а княжна играла на клавикордах.|Война и мир. Том 1|Лев Николаевич Толстой|sfw
12:10|12:10|12:10: Между 12 и 2 часами, сообразно с заведенным порядком дня, князь отдыхал, а княжна играла на клавикордах.|Война и мир. Том 1|Лев Николаевич Толстой|sfw
12:11|12:11|12:11: Между 12 и 2 часами, сообразно с заведенным порядком дня, князь отдыхал, а княжна играла на клавикордах.|Война и мир. Том 1|Лев Николаевич Толстой|sfw
12:12|12:12|12:12: Между 12 и 2 часами, сообразно с заведенным порядком дня, князь отдыхал, а княжна играла на клавикордах.|Война и мир. Том 1|Лев Николаевич Толстой|sfw
12:13|12:13|12:13: Между 12 и 2 часами, сообразно с заведенным порядком дня, князь отдыхал, а княжна играла на клавикордах.|Война и мир. Том 1|Лев Николаевич Толстой|sfw
12:14|12:14|12:14: Между 12 и 2 часами, сообразно с заведенным порядком дня, князь отдыхал, а княжна играла на клавикордах.|Война и мир. Том 1|Лев Николаевич Толстой|sfw
12:15|12:15|12:15: Между 12 и 2 часами, сообразно с заведенным порядком дня, князь отдыхал, а княжна играла на клавикордах.|Война и мир. Том 1|Лев Николаевич Толстой|sfw
12:16|12:16|12:16: Между 12 и 2 часами, сообразно с заведенным порядком дня, князь отдыхал, а княжна играла на клавикордах.|Война и мир. Том 1|Лев Николаевич Толстой|sfw
12:17|двенадцать семнадцать|Чем больше я мечтал, тем труднее мне было оставаться на наблюдательном посту. В последние полчаса своего двухчасового дежурства я считал минуты, как ребенок, дожидающийся рождественского утра. Когда время подошло - часы показывали двенадцать семнадцать, - я в последний раз взглянул на Зефа и Сэмми. В первый раз за день никого не было видно, но я колебался лишь мгновение. Я быстро осмотрел море, убедился, что они не отправились вплавь, затем сказал вслух: "Черт с ними!" - и стал спускаться.|Пляж|Алекс Гарленд|sfw
12:18|12:18|12:18: Между 12 и 2 часами, сообразно с заведенным порядком дня, князь отдыхал, а княжна играла на клавикордах.|Война и мир. Том 1|Лев Николаевич Толстой|sfw
